{
  "area": {
    "active_gate_area_um2": 97.248,
    "c_count": 0,
    "c_total_f": 0.0,
    "mos_count": 10,
    "r_count": 0,
    "r_total_ohm": 0.0
  },
  "circuit": "amp_018_telescopic_cascode",
  "corners": {
    "tt": {
      "analyses": {
        "ac_open_loop": {
          "measures": {
            "dcgain": 52.18988,
            "pm": 88.98885,
            "ugf": 300205.7
          },
          "status": "ok"
        },
        "cmrr_vcm": {
          "measures": {
            "cmrr_db": 96.49122
          },
          "status": "ok"
        },
        "dc_op": {
          "measures": {
            "i_supply": 7.600691e-06
          },
          "status": "ok"
        },
        "iip3": {
          "measures": {
            "a_drv": 0.006249378,
            "a_f1": 0.006231894,
            "a_f2": 0.006231151,
            "a_floor": 4.096701e-12,
            "a_im3h": 1.060451e-09,
            "a_im3l": 1.013298e-09,
            "a_im5h": 4.696973e-12,
            "a_im5l": 1.829321e-12,
            "gain_tone": 0.9970834,
            "gain_tone_db": -0.0253704,
            "iip3_comp_db": 0.09615834,
            "iip3_dbv": 23.60837,
            "im3_dbc": -135.382,
            "im5_im3_db": -47.0735
          },
          "status": "ok"
        },
        "linearity": {
          "status": "disabled"
        },
        "noise": {
          "measures": {
            "inoise_total": 0.0001252546,
            "onoise_total": 0.03222237
          },
          "status": "ok"
        },
        "psrr_vdd": {
          "measures": {
            "psrr_vdd_db": 52.72374
          },
          "status": "ok"
        },
        "stb": {
          "measures": {
            "gm_loop": -999.0,
            "loopgain_db": 52.36059,
            "phref_dev": -7.70999e-06,
            "phref_ok": 1.0,
            "pm_loop": 88.94469,
            "pm_loop_first": 88.94469,
            "ugf_loop": 300257.3
          },
          "status": "ok"
        },
        "thd": {
          "measures": {
            "a1": 0.04985283,
            "a1_in": 0.0499992,
            "a2": 8.596718e-06,
            "a3": 2.712684e-07,
            "a4": 4.811621e-08,
            "a5": 8.952533e-09,
            "gain_tone": 0.9970724,
            "thd_db": -75.2627,
            "thd_pct": 0.01725306,
            "vout_op": 0.8001205
          },
          "status": "ok"
        },
        "tran_step": {
          "measures": {
            "t_settle": 2.42945e-06,
            "tcross": 3.42945e-06,
            "vfinal": 0.9992186
          },
          "status": "ok"
        }
      },
      "provenance": {
        "generator": "analog-db run",
        "ngspice": "45",
        "run_at": "2026-08-04T04:34:41+00:00"
      }
    }
  },
  "design_id": "a4f0ac8fca",
  "metrics": {
    "tt": {
      "cmrr_db": {
        "spec": "pass",
        "value": 96.49122
      },
      "dc_gain_db": {
        "spec": "pass",
        "value": 52.18988
      },
      "gm_loop_db": {
        "spec": "none",
        "value": -999.0
      },
      "i_supply": {
        "spec": "pass",
        "value": 7.600691e-06
      },
      "iip3_dbv": {
        "spec": "pass",
        "value": 23.60837
      },
      "loopgain_db": {
        "spec": "none",
        "value": 52.36059
      },
      "pm_deg": {
        "spec": "pass",
        "value": 88.98885
      },
      "pm_loop_deg": {
        "spec": "pass",
        "value": 88.94469
      },
      "psrr_vdd_db": {
        "spec": "pass",
        "value": 52.72374
      },
      "t_settle": {
        "spec": "pass",
        "value": 2.42945e-06
      },
      "thd_pct": {
        "spec": "pass",
        "value": 0.01725306
      },
      "ugf_hz": {
        "spec": "fail",
        "value": 300205.7
      },
      "ugf_loop_hz": {
        "spec": "none",
        "value": 300257.3
      },
      "vn_in_integrated": {
        "spec": "none",
        "value": 0.0001252546
      }
    }
  },
  "parameters": {
    "sizing": {
      "x_dut_v_bias_1": 0.509,
      "x_dut_v_bias_2": 1.032,
      "x_dut_xm1_l": 7.791216446889749e-07,
      "x_dut_xm1_m": 1,
      "x_dut_xm1_w": 6.116280667583133e-07,
      "x_dut_xm1c_l": 9.920210290687422e-07,
      "x_dut_xm1c_m": 1,
      "x_dut_xm1c_w": 6.96391065616068e-06,
      "x_dut_xm2_m": 1,
      "x_dut_xm2c_m": 1,
      "x_dut_xm3_l": 5.45823761118433e-06,
      "x_dut_xm3_m": 1,
      "x_dut_xm3_w": 1.7141886411301278e-06,
      "x_dut_xm3c_l": 3.883557926921232e-07,
      "x_dut_xm3c_m": 1,
      "x_dut_xm3c_w": 8.795623406543892e-06,
      "x_dut_xm4_m": 1,
      "x_dut_xm4c_m": 1,
      "x_dut_xm5_l": 3.7679599937261675e-06,
      "x_dut_xm5_m": 1,
      "x_dut_xm5_ng": 2,
      "x_dut_xm5_w": 4.7008952481424335e-06,
      "x_dut_xm6_l": 4.815201971218506e-06,
      "x_dut_xm6_m": 1,
      "x_dut_xm6_w": 8.145207701283387e-06
    }
  },
  "pdk": "ihp-sg13g2",
  "ppa": {
    "active_gate_area_um2": 97.248,
    "corners_run": [
      "tt"
    ],
    "performance": {
      "dc_gain_db": 52.18988,
      "pm_deg": 88.98885,
      "ugf_hz": 300205.7
    },
    "power_w": 1.1401036500000001e-05
  },
  "schema": "spicexplorer/scoreboard-entry@1"
}
