{
  "area": {
    "active_gate_area_um2": 893.937,
    "c_count": 2,
    "c_total_f": 9.346410491858182e-12,
    "mos_count": 24,
    "r_count": 0,
    "r_total_ohm": 0.0
  },
  "circuit": "amp_008_leung_nmcf",
  "corners": {
    "tt": {
      "analyses": {
        "ac_open_loop": {
          "measures": {
            "dcgain": 118.245,
            "pm": 74.46832,
            "ugf": 2005053.0
          },
          "status": "ok"
        },
        "cmrr_vcm": {
          "measures": {
            "cmrr_db": 44.58785
          },
          "status": "ok"
        },
        "dc_op": {
          "measures": {
            "i_supply": 0.0001234601,
            "vos": 0.0004630881
          },
          "status": "ok"
        },
        "iip3": {
          "measures": {
            "a_drv": 0.006249652,
            "a_f1": 0.007152985,
            "a_f2": 0.007131072,
            "a_floor": 1.133212e-05,
            "a_im3h": 1.12896e-05,
            "a_im3l": 3.099939e-05,
            "a_im5h": 3.30758e-05,
            "a_im5l": 3.477868e-05,
            "gain_tone": 1.141035,
            "gain_tone_db": 1.14598,
            "iip3_comp_db": 24.35678,
            "iip3_dbv": -20.4644,
            "im3_dbc": -47.236,
            "im5_im3_db": 0.9992011
          },
          "status": "ok"
        },
        "noise": {
          "measures": {
            "inoise_total": 0.0001096619,
            "onoise_total": 11.48155
          },
          "status": "ok"
        },
        "psrr_vdd": {
          "measures": {
            "psrr_vdd_db": 44.18415
          },
          "status": "ok"
        },
        "stb": {
          "measures": {
            "gm_loop": -3.32301,
            "loopgain_db": 118.2602,
            "phref_dev": -0.341146,
            "phref_ok": 1.0,
            "pm_loop": -46.8687,
            "pm_loop_first": 71.05476,
            "ugf_loop": 4981078.0
          },
          "status": "ok"
        },
        "thd": {
          "measures": {
            "a1": 0.05551273,
            "a1_in": 0.04999935,
            "a2": 0.001193545,
            "a3": 0.0002746488,
            "a4": 0.000321624,
            "a5": 0.0002807654,
            "gain_tone": 1.110269,
            "thd_db": -32.6289,
            "thd_pct": 2.336431,
            "vout_op": 0.3127024
          },
          "status": "ok"
        },
        "tran_step": {
          "measures": {
            "t_settle": 0.0001989984,
            "tcross": 0.0001999984,
            "vfinal": 0.5824327
          },
          "status": "ok"
        }
      },
      "provenance": {
        "generator": "analog-db run",
        "ngspice": "45",
        "run_at": "2026-08-01T18:19:11+00:00"
      }
    }
  },
  "design_id": "2b7c766ebe",
  "metrics": {
    "tt": {
      "cmrr_db": {
        "spec": "pass",
        "value": 44.58785
      },
      "dc_gain_db": {
        "spec": "pass",
        "value": 118.245
      },
      "gm_loop_db": {
        "spec": "none",
        "value": -3.32301
      },
      "i_supply": {
        "spec": "pass",
        "value": 0.0001234601
      },
      "iip3_dbv": {
        "spec": "fail",
        "value": -20.4644
      },
      "loopgain_db": {
        "spec": "none",
        "value": 118.2602
      },
      "pm_deg": {
        "spec": "pass",
        "value": 74.46832
      },
      "pm_loop_deg": {
        "spec": "fail",
        "value": -46.8687
      },
      "psrr_vdd_db": {
        "spec": "pass",
        "value": 44.18415
      },
      "t_settle": {
        "spec": "fail",
        "value": 0.0001989984
      },
      "thd_pct": {
        "spec": "fail",
        "value": 2.336431
      },
      "ugf_hz": {
        "spec": "pass",
        "value": 2005053.0
      },
      "ugf_loop_hz": {
        "spec": "none",
        "value": 4981078.0
      },
      "vn_in_integrated": {
        "spec": "none",
        "value": 0.0001096619
      }
    }
  },
  "parameters": {
    "sizing": {
      "CAPACITOR_0": 8.26424276740667e-12,
      "CAPACITOR_1": 1.0821677244515127e-12,
      "CURRENT_0_BIAS": 1.1201895459991615e-05,
      "x_dut_xm10_l": 1.6770387922091954,
      "x_dut_xm10_m": "4",
      "x_dut_xm10_w": 1.5141347632369768,
      "x_dut_xm11_l": 1.4703504443531135,
      "x_dut_xm11_m": "4",
      "x_dut_xm11_w": 0.7587965903897456,
      "x_dut_xm14_l": 1.7103283952228343,
      "x_dut_xm14_m": "4",
      "x_dut_xm14_w": 2.9012517287679387,
      "x_dut_xm21_l": 0.7408405260225203,
      "x_dut_xm21_m": "4",
      "x_dut_xm21_w": 0.806015076543216,
      "x_dut_xm23_l": 2.057099925217734,
      "x_dut_xm23_m": "4",
      "x_dut_xm23_w": 2.9464092583272543,
      "x_dut_xm7_l": 1.6668854704514848,
      "x_dut_xm7_m": "4",
      "x_dut_xm7_w": 0.42848468048881905,
      "x_dut_xm9_l": 0.7135849563668724,
      "x_dut_xm9_m": "4",
      "x_dut_xm9_w": 0.8910336245021608
    }
  },
  "pdk": "sky130",
  "ppa": {
    "active_gate_area_um2": 893.937,
    "corners_run": [
      "tt"
    ],
    "performance": {
      "dc_gain_db": 118.245,
      "pm_deg": 74.46832,
      "ugf_hz": 2005053.0
    },
    "power_w": 0.00022222818
  },
  "schema": "spicexplorer/scoreboard-entry@1"
}
