{
  "area": {
    "active_gate_area_um2": 204.0,
    "c_count": 3,
    "c_total_f": 1.5240000000000002e-12,
    "mos_count": 25,
    "r_count": 4,
    "r_total_ohm": 460000.0
  },
  "circuit": "amp_013_qu2017_azc",
  "corners": {
    "tt": {
      "analyses": {
        "ac_open_loop": {
          "measures": {
            "dcgain": 105.3036,
            "pm": 33.63685,
            "ugf": 1115502.0
          },
          "status": "ok"
        },
        "cmrr_vcm": {
          "measures": {
            "cmrr_db": 67.95183
          },
          "status": "ok"
        },
        "dc_op": {
          "measures": {
            "i_supply": 3.874693e-05,
            "vos": -0.00268796
          },
          "status": "ok"
        },
        "noise": {
          "measures": {
            "inoise_total": 0.02504689,
            "onoise_total": 0.04415401
          },
          "status": "ok"
        },
        "psrr_vdd": {
          "measures": {
            "psrr_vdd_db": 37.42612
          },
          "status": "ok"
        },
        "tran_step": {
          "measures": {
            "t_settle": 9.44708e-06,
            "tcross": 1.044708e-05,
            "vfinal": 0.4973604
          },
          "status": "ok"
        }
      },
      "provenance": {
        "generator": "analog-db run",
        "ngspice": "45",
        "run_at": "2026-07-21T02:17:18+00:00"
      }
    }
  },
  "design_id": "c3fc7beb79",
  "metrics": {
    "tt": {
      "cmrr_db": {
        "spec": "pass",
        "value": 67.95183
      },
      "dc_gain_db": {
        "spec": "pass",
        "value": 105.3036
      },
      "i_supply": {
        "spec": "none",
        "value": 3.874693e-05
      },
      "pm_deg": {
        "spec": "fail",
        "value": 33.63685
      },
      "psrr_vdd_db": {
        "spec": "pass",
        "value": 37.42612
      },
      "t_settle": {
        "spec": "fail",
        "value": 9.44708e-06
      },
      "ugf_hz": {
        "spec": "none",
        "value": 1115502.0
      },
      "vn_in": {
        "spec": "none",
        "value": 0.02504689
      }
    }
  },
  "parameters": {
    "sizing": {
      "CAPACITOR_0": "810f",
      "CAPACITOR_1": "404f",
      "CAPACITOR_2": "310f",
      "CURRENT_0_BIAS": "1u",
      "RESISTOR_0": "35K",
      "RESISTOR_1": "35k",
      "RESISTOR_2": "350k",
      "RESISTOR_3": "40k",
      "x_dut_xm10_l": "1u",
      "x_dut_xm10_m": "4",
      "x_dut_xm10_w": "1u",
      "x_dut_xm11_l": "1u",
      "x_dut_xm11_m": "4",
      "x_dut_xm11_w": "1u",
      "x_dut_xm12_l": "1u",
      "x_dut_xm12_m": "4",
      "x_dut_xm12_w": "1u",
      "x_dut_xm13_l": "1u",
      "x_dut_xm13_m": "4",
      "x_dut_xm13_w": "1u",
      "x_dut_xm16_l": "1u",
      "x_dut_xm16_m": "4",
      "x_dut_xm16_w": "1u",
      "x_dut_xm18_l": "1u",
      "x_dut_xm18_m": "4",
      "x_dut_xm18_w": "1u",
      "x_dut_xm19_l": "1u",
      "x_dut_xm19_m": "4",
      "x_dut_xm20_w": "7u",
      "x_dut_xm24_l": "1u",
      "x_dut_xm24_m": "4",
      "x_dut_xm24_w": "1u",
      "x_dut_xm3_l": "1u",
      "x_dut_xm3_w": "1u",
      "x_dut_xm5_m": "4",
      "x_dut_xm6_l": "1u",
      "x_dut_xm6_m": "4",
      "x_dut_xm6_w": "1u"
    }
  },
  "pdk": "gf180mcu",
  "ppa": {
    "active_gate_area_um2": 204.0,
    "corners_run": [
      "tt"
    ],
    "performance": {
      "dc_gain_db": 105.3036,
      "pm_deg": 33.63685,
      "ugf_hz": 1115502.0
    },
    "power_w": 6.9744474e-05
  },
  "schema": "spicexplorer/scoreboard-entry@1"
}
